[
  {
    "id": "wilde-artist-en-methuen-1913",
    "work_id": "wilde-the-artist",
    "language": "en",
    "title": "The Artist",
    "kind": "source",
    "status": "published",
    "label": "Original English · 1913 Methuen edition (Project Gutenberg #774)",
    "content_path": "corpus/segments/wilde-the-artist/wilde-artist-en-methuen-1913.json",
    "source_edition_id": null,
    "legacy_slugs": [],
    "provenance": {
      "citation": "Oscar Wilde, “The Artist,” Poems in Prose (Fortnightly Review, July 1894); in Essays and Lectures, 4th ed., Methuen & Co. Ltd., 1913, pp. 227–228. Digital transcription: David Price, Project Gutenberg #774.",
      "catalog_url": "https://www.gutenberg.org/ebooks/774",
      "text_url": "https://www.gutenberg.org/cache/epub/774/pg774-images.html",
      "retrieved_at": "2026-10-31",
      "source_witness": "1913 Methuen fourth edition; electronic transcription, not a facsimile of the 1894 printing."
    },
    "rights": {
      "status": "public_domain_assessed",
      "license": "Public Domain (underlying Oscar Wilde text)",
      "basis": "Oscar Wilde died in 1900; 'The Artist' appeared in 1894 and the selected print witness is from 1913. Assessed public domain: USA (pre-1931), EU (usually life plus 70) and Vietnam (ordinary literary works, life plus 50 under Article 27). Moral rights and variant editions must still be respected. Not a global legal guarantee.",
      "jurisdictions_assessed": [
        "US",
        "EU",
        "VN"
      ],
      "evidence_urls": [
        "https://www.gutenberg.org/ebooks/774",
        "https://www.themorgan.org/collection/oscar-wilde/manuscripts-letters/13",
        "https://cov.gov.vn/quyen-tac-gia-quyen-lien-quan/thoi-han-bao-ho-quyen-tac-gia-la-bao-nhieu-nam-168808.html",
        "https://www.copyright.gov/circs/circ38b.pdf",
        "https://www.copyright.gov/title17/92chap3.html",
        "https://eur-lex.europa.eu/legal-content/EN/TXT/?uri=CELEX:32006L0116"
      ]
    },
    "credits": {
      "author": "Oscar Wilde",
      "translator": null,
      "editors": [],
      "ai_assisted": true
    },
    "review": {
      "status": "source_checked",
      "reviewers": [],
      "evidence_urls": [
        "https://www.gutenberg.org/cache/epub/774/pg774-images.html"
      ],
      "notes": "Five complete paragraphs rechecked against the identified Gutenberg reproduction on 2026-11-01: exact match after HTML/whitespace normalization, plus AI-assisted passage comparison. This technical source check does not assert human peer review or a certified critical edition."
    }
  },
  {
    "id": "wilde-artist-vi-ai-draft-2026",
    "work_id": "wilde-the-artist",
    "language": "vi",
    "title": "Nghệ sĩ",
    "kind": "translation",
    "status": "published",
    "label": "Bản dịch tiếng Việt bằng AI · đánh giá AI v2",
    "content_path": "corpus/segments/wilde-the-artist/wilde-artist-vi-ai-draft-2026.json",
    "source_edition_id": "wilde-artist-en-methuen-1913",
    "legacy_slugs": [],
    "provenance": {
      "citation": "Direct working draft translated from the LitMundi English source edition; not based on a modern third-party translation.",
      "catalog_url": null,
      "text_url": null,
      "retrieved_at": "2026-11-01",
      "source_witness": "wilde-artist-en-methuen-1913"
    },
    "rights": {
      "status": "cleared",
      "license": "CC-BY-4.0",
      "basis": "AI-produced Vietnamese translation generated and revised directly from the separately assessed historical original. Under the project AI-content policy, any applicable rights controlled by the publishing maintainer are offered under CC BY 4.0. No human authorship, exclusive copyright, new restriction on public-domain material or worldwide protection is asserted; original-source and third-party rights remain separate. No human creative contributors are recorded for this edition.",
      "jurisdictions_assessed": [
        "US",
        "EU",
        "VN"
      ],
      "evidence_urls": [
        "https://github.com/streamentry/LitMundi/blob/main/docs/AI-CONTENT-POLICY.md",
        "https://creativecommons.org/licenses/by/4.0/legalcode.en",
        "https://openai.com/policies/services-agreement/",
        "https://www.gutenberg.org/ebooks/774",
        "https://www.themorgan.org/collection/oscar-wilde/manuscripts-letters/13",
        "https://cov.gov.vn/quyen-tac-gia-quyen-lien-quan/thoi-han-bao-ho-quyen-tac-gia-la-bao-nhieu-nam-168808.html",
        "https://www.copyright.gov/circs/circ38b.pdf",
        "https://www.copyright.gov/title17/92chap3.html",
        "https://eur-lex.europa.eu/legal-content/EN/TXT/?uri=CELEX:32006L0116"
      ]
    },
    "credits": {
      "author": "Oscar Wilde",
      "translator": "LitMundi AI translation (ChatGPT)",
      "editors": [],
      "ai_assisted": true
    },
    "review": {
      "status": "ai_reviewed",
      "reviewers": [],
      "ai_reviewers": [
        "litmundi-ai-literary-assessment"
      ],
      "rubric_id": "litmundi-literary-v2",
      "score": 8.6,
      "record_paths": [
        "corpus/reviews/wilde-the-artist/wilde-artist-vi-ai-draft-2026/ai-review-v2-titles-2026-11-01.json"
      ],
      "evidence_urls": [
        "https://github.com/streamentry/LitMundi/blob/main/corpus/reviews/wilde-the-artist/wilde-artist-vi-ai-draft-2026/ai-review-v2-titles-2026-11-01.json"
      ],
      "notes": "AI literary assessment under v2: weighted score 8.60/10 (unrounded 8.6); publication threshold 8.6. All canonical passages were compared with the exact source and target hashes. This is an AI evaluation, not an independent human endorsement or calibrated quality measurement. Readers may submit corrections after publication. Same-model author/assessor correlation and prior-score exposure are disclosed in the record. Fresh title-aware review rechecked every body passage and records the exact source and Vietnamese edition titles. Body text and scores are unchanged; the previous review remains history."
    },
    "publication_policy": "litmundi-literary-v2",
    "generation": {
      "kind": "ai_generated",
      "tools": [
        "ChatGPT (AI translation and literary revision)"
      ],
      "direct_from_original": true,
      "human_contributors": [],
      "notes": "Generated and revised directly from the cited original-language source using AI. No human creative translator/editor or independent human literary approval is recorded. The assessment record discloses its model, method and limitations."
    }
  },
  {
    "id": "wilde-artist-vi-community-proposed",
    "work_id": "wilde-the-artist",
    "language": "vi",
    "kind": "translation",
    "status": "planned",
    "label": "Tiếng Việt · bản dịch cộng đồng độc lập (chưa có nội dung)",
    "content_path": null,
    "source_edition_id": "wilde-artist-en-methuen-1913",
    "legacy_slugs": [],
    "provenance": {
      "citation": "No edition submitted.",
      "catalog_url": null,
      "text_url": null,
      "retrieved_at": null,
      "source_witness": null
    },
    "rights": {
      "status": "unreviewed",
      "license": null,
      "basis": "Future edition; rights and contributor consent required.",
      "jurisdictions_assessed": [],
      "evidence_urls": []
    },
    "credits": {
      "author": "Oscar Wilde",
      "translator": null,
      "editors": [],
      "ai_assisted": false
    },
    "review": {
      "status": "unreviewed",
      "reviewers": [],
      "evidence_urls": [],
      "notes": "Second same-language edition demonstrates independent edition identifiers; contains no content."
    }
  },
  {
    "id": "proust-swann-fr-sample",
    "work_id": "demo-proust",
    "language": "fr",
    "title": "Du côté de chez Swann",
    "kind": "source",
    "status": "sample",
    "label": "Unverified formatting excerpt (not a complete book)",
    "content_path": "corpus/segments/demo-proust/fr.json",
    "source_edition_id": null,
    "legacy_slugs": [
      "fr"
    ],
    "provenance": {
      "citation": "No source edition has been selected for this demonstration.",
      "catalog_url": null,
      "text_url": null,
      "retrieved_at": null,
      "source_witness": null
    },
    "rights": {
      "status": "unreviewed",
      "license": null,
      "basis": "Not a publishable edition.",
      "jurisdictions_assessed": [],
      "evidence_urls": []
    },
    "credits": {
      "author": "Marcel Proust",
      "translator": null,
      "editors": [],
      "ai_assisted": false
    },
    "review": {
      "status": "unreviewed",
      "reviewers": [],
      "evidence_urls": [],
      "notes": "Demo only; no assertion of textual completeness."
    }
  },
  {
    "id": "proust-swann-vi-planned",
    "work_id": "demo-proust",
    "language": "vi",
    "kind": "translation",
    "status": "planned",
    "label": "Tiếng Việt · chưa có bản dịch",
    "content_path": null,
    "source_edition_id": "proust-swann-fr-sample",
    "legacy_slugs": [],
    "provenance": {
      "citation": "No source edition selected.",
      "catalog_url": null,
      "text_url": null,
      "retrieved_at": null,
      "source_witness": null
    },
    "rights": {
      "status": "unreviewed",
      "license": null,
      "basis": "Future edition",
      "jurisdictions_assessed": [],
      "evidence_urls": []
    },
    "credits": {
      "author": "Marcel Proust",
      "translator": null,
      "editors": [],
      "ai_assisted": false
    },
    "review": {
      "status": "unreviewed",
      "reviewers": [],
      "evidence_urls": [],
      "notes": "Not published."
    }
  },
  {
    "id": "proust-swann-en-planned",
    "work_id": "demo-proust",
    "language": "en",
    "kind": "translation",
    "status": "planned",
    "label": "English · no translation available",
    "content_path": null,
    "source_edition_id": "proust-swann-fr-sample",
    "legacy_slugs": [],
    "provenance": {
      "citation": "No source edition selected.",
      "catalog_url": null,